{
  "name": "reckoning-weeks",
  "description": "Three ISO weeks (UTC) of contributions for ten res-9 cells around Kaunas town hall, one per row of the ownership table in docs/territory-rules.md plus cap/bonus, decay-to-unclaimed, bonus-only and the incumbent-below-min gap: no-faction-reaches-min, first-claim, challenger-beats-hysteresis, hysteresis-holds, incumbent-decays-below-min-no-challenger, exact-tie-incumbent-keeps, exact-tie-no-incumbent, cap-and-bonus, incumbent-below-min-challenger-above-min, bonus-only. Week N+1 initial state is week N expected. parentCases cover deriveParentOwner (plurality > 40 % of ≥ 2 claimed children, ties unclaimed).",
  "generator": "scripts/generate.ts#reckoningWeeks",
  "version": 1,
  "seed": 20260907,
  "factions": [1, 2, 3],
  "weeks": ["2026-W35", "2026-W36", "2026-W37"],
  "cells": [
    {
      "id": "no-faction-reaches-min",
      "description": "Table row \"No faction reaches MIN_STRENGTH (500 m) → unclaimed\": 300/400 m in W35, decaying and topping up below 500 in W36–W37; never claimed.",
      "cell": "891f40da913ffff",
      "initial": {
        "owner": null,
        "strengths": []
      },
      "weeks": [
        {
          "weekId": "2026-W35",
          "contributions": [
            {
              "factionId": 1,
              "userId": "u1",
              "meters": 300
            },
            {
              "factionId": 2,
              "userId": "u2",
              "meters": 400
            }
          ],
          "bonuses": [],
          "expected": {
            "capped": [
              {
                "factionId": 1,
                "userId": "u1",
                "cappedMeters": 300
              },
              {
                "factionId": 2,
                "userId": "u2",
                "cappedMeters": 400
              }
            ],
            "strengths": [
              {
                "factionId": 1,
                "strength": 300
              },
              {
                "factionId": 2,
                "strength": 400
              }
            ],
            "owner": null,
            "flipped": false,
            "captain": null
          }
        },
        {
          "weekId": "2026-W36",
          "contributions": [
            {
              "factionId": 1,
              "userId": "u1",
              "meters": 100
            }
          ],
          "bonuses": [],
          "expected": {
            "capped": [
              {
                "factionId": 1,
                "userId": "u1",
                "cappedMeters": 100
              }
            ],
            "strengths": [
              {
                "factionId": 1,
                "strength": 250
              },
              {
                "factionId": 2,
                "strength": 200
              }
            ],
            "owner": null,
            "flipped": false,
            "captain": null
          }
        },
        {
          "weekId": "2026-W37",
          "contributions": [
            {
              "factionId": 2,
              "userId": "u2",
              "meters": 250
            }
          ],
          "bonuses": [],
          "expected": {
            "capped": [
              {
                "factionId": 2,
                "userId": "u2",
                "cappedMeters": 250
              }
            ],
            "strengths": [
              {
                "factionId": 1,
                "strength": 125
              },
              {
                "factionId": 2,
                "strength": 350
              }
            ],
            "owner": null,
            "flipped": false,
            "captain": null
          }
        }
      ]
    },
    {
      "id": "first-claim",
      "description": "Table row \"No incumbent, one faction ≥ 500 m → that faction\": 800 m claims in W35 (event null→1), then the incumbent keeps with 600 and 700 m of strength.",
      "cell": "891f40da983ffff",
      "initial": {
        "owner": null,
        "strengths": []
      },
      "weeks": [
        {
          "weekId": "2026-W35",
          "contributions": [
            {
              "factionId": 1,
              "userId": "u1",
              "meters": 800
            }
          ],
          "bonuses": [],
          "expected": {
            "capped": [
              {
                "factionId": 1,
                "userId": "u1",
                "cappedMeters": 800
              }
            ],
            "strengths": [
              {
                "factionId": 1,
                "strength": 800
              }
            ],
            "owner": 1,
            "flipped": true,
            "captain": "u1",
            "event": {
              "from": null,
              "to": 1
            }
          }
        },
        {
          "weekId": "2026-W36",
          "contributions": [
            {
              "factionId": 1,
              "userId": "u1",
              "meters": 200
            }
          ],
          "bonuses": [],
          "expected": {
            "capped": [
              {
                "factionId": 1,
                "userId": "u1",
                "cappedMeters": 200
              }
            ],
            "strengths": [
              {
                "factionId": 1,
                "strength": 600
              }
            ],
            "owner": 1,
            "flipped": false,
            "captain": "u1"
          }
        },
        {
          "weekId": "2026-W37",
          "contributions": [
            {
              "factionId": 1,
              "userId": "u1",
              "meters": 400
            }
          ],
          "bonuses": [],
          "expected": {
            "capped": [
              {
                "factionId": 1,
                "userId": "u1",
                "cappedMeters": 400
              }
            ],
            "strengths": [
              {
                "factionId": 1,
                "strength": 700
              }
            ],
            "owner": 1,
            "flipped": false,
            "captain": "u1"
          }
        }
      ]
    },
    {
      "id": "challenger-beats-hysteresis",
      "description": "Table row \"Challenger strength′ ≥ incumbent × 1.10 → challenger takes the cell\": faction 2 reaches 700 vs 600 (≥ 660) in W36 and flips it; faction 1 flips it back in W37 with 500 vs 350 (≥ 385).",
      "cell": "891f40da987ffff",
      "initial": {
        "owner": null,
        "strengths": []
      },
      "weeks": [
        {
          "weekId": "2026-W35",
          "contributions": [
            {
              "factionId": 1,
              "userId": "u1",
              "meters": 1000
            }
          ],
          "bonuses": [],
          "expected": {
            "capped": [
              {
                "factionId": 1,
                "userId": "u1",
                "cappedMeters": 1000
              }
            ],
            "strengths": [
              {
                "factionId": 1,
                "strength": 1000
              }
            ],
            "owner": 1,
            "flipped": true,
            "captain": "u1",
            "event": {
              "from": null,
              "to": 1
            }
          }
        },
        {
          "weekId": "2026-W36",
          "contributions": [
            {
              "factionId": 1,
              "userId": "u1",
              "meters": 100
            },
            {
              "factionId": 2,
              "userId": "u2",
              "meters": 700
            }
          ],
          "bonuses": [],
          "expected": {
            "capped": [
              {
                "factionId": 1,
                "userId": "u1",
                "cappedMeters": 100
              },
              {
                "factionId": 2,
                "userId": "u2",
                "cappedMeters": 700
              }
            ],
            "strengths": [
              {
                "factionId": 1,
                "strength": 600
              },
              {
                "factionId": 2,
                "strength": 700
              }
            ],
            "owner": 2,
            "flipped": true,
            "captain": "u2",
            "event": {
              "from": 1,
              "to": 2
            }
          }
        },
        {
          "weekId": "2026-W37",
          "contributions": [
            {
              "factionId": 1,
              "userId": "u1",
              "meters": 200
            }
          ],
          "bonuses": [],
          "expected": {
            "capped": [
              {
                "factionId": 1,
                "userId": "u1",
                "cappedMeters": 200
              }
            ],
            "strengths": [
              {
                "factionId": 1,
                "strength": 500
              },
              {
                "factionId": 2,
                "strength": 350
              }
            ],
            "owner": 1,
            "flipped": true,
            "captain": "u1",
            "event": {
              "from": 2,
              "to": 1
            }
          }
        }
      ]
    },
    {
      "id": "hysteresis-holds",
      "description": "Table row \"Incumbent still ≥ 500 m and no challenger clears hysteresis → incumbent keeps\": W35 as in data-model.md §1.5 (2 600 m capped to 2 000 + 300, bonus 300 for faction 2); in W36 faction 2 reaches exactly 1 312.5 = 1.05 × 1 250 and leads on strength but does not flip; W37 decays both (656.25 vs 625) and still holds.",
      "cell": "891f40da98bffff",
      "initial": {
        "owner": null,
        "strengths": []
      },
      "weeks": [
        {
          "weekId": "2026-W35",
          "contributions": [
            {
              "factionId": 1,
              "userId": "u1",
              "meters": 2600
            },
            {